id	title
OSD-363	Inflammatory gene expression signatures in idiopathic intracranial hypertension: possible implications in microgravity-induced ICP elevation - CSF
OSD-364	Inflammatory gene expression signatures in idiopathic intracranial hypertension: possible implications in microgravity-induced ICP elevation - Plasma
OSD-367	Bystander response to 0.5 Gy of alpha-particles in a human 3-dimensional skin model in 16h after exposure to ionizing radiation
OSD-368	Biological response to low dose of alpha-particles in a human 3-dimensional skin model, in 1 and 16h after exposure to ionizing radiation.
OSD-369	Bystander responses to 0.5Gy of alpha-particles in a human 3-dimensional skin model in 4h after exposure to ionizing radiation
OSD-37	Comparison of the spaceflight transcriptome of four commonly used Arabidopsis thaliana ecotypes
OSD-370	Insulin resistance induced by physical inactivity is associated with multiple transcriptional changes in skeletal muscle in young men
OSD-372	Genome sequencing of Staphylococcus, Burkholderia, and Ralstonia bacterial isolates isolated from the ISS
OSD-373	RNA sequencing of zebrafish embryos under simulated microgravity conditions
OSD-374	Bi-directional and shared epigenomic signatures following proton irradiation
OSD-375	Transcriptional profiling of roots and shoots from Brachypodium distachyon seedlings flown on the ISS
OSD-379	Transcriptional profiling of livers from mice flown on Rodent Research Reference Mission-1 (RRRM-1)
OSD-38	Proteomics and Transcriptomics analysis of Arabidopsis Seedlings in Microgravity
OSD-383	Long-read sequencing reveals increased occurrence of genomic variants and adenosine methylation in Bacillus pumilus SAFR-032 after long-duration flight exposure onboard the International Space Station
OSD-385	Persistence of Escherichia coli in the microbiomes of red Romaine lettuce (Lactuca sativa cv. ‘Outredgeous’)- does seed sanitization matter?
OSD-386	Persistence of Escherichia coli in the microbiomes of mizuna mustard (Brassica rapa var. japonica) - does seed sanitization matter?
OSD-39	BASE-A space experiment with Rhodospirillum rubrum S1H
OSD-391	Draft Genome Sequences of Heat-Shock Tolerant Firmicutes Isolated from a Spacecraft Assembly Facility
OSD-396	Gene-metabolite networks associated with impediment of bone fracture repair in spaceflight
OSD-397	Illumina NGS RNA-seq and RRBS Sequencing on Spaceflight Mouse Retina
OSD-4	Microarray Analysis of Space-flown Murine Thymus Tissue
OSD-40	Gene expression profiling of C. elegans under various thermal conditions
OSD-400	Draft Genomes of Fungi Isolated from the International Space Station during the Microbial Tracking-2 Experiment
OSD-401	Alternative splicing regulates the physiological adaptation of the mouse hind limb postural and phasic muscles to microgravity
OSD-402	Single cell transcriptional profiling of femur bone marrow from mice flown on Rodent Research Reference Mission-2 (RRRM-2)
OSD-403	Single cell transcriptional profiling of humerus bone marrow from mice flown on Rodent Research Reference Mission-2 (RRRM-2)
OSD-404	Single cell transcriptional profiling of peripheral blood mononuclear cells (PBMCs) from mice flown on Rodent Research Reference Mission-2 (RRRM-2)
OSD-405	Single cell transcriptional profiling of spleens from mice flown on Rodent Research Reference Mission-2 (RRRM-2)
OSD-406	Transcriptomic responses of Arabidopsis thaliana lines WS and sku5 to the Blue Origin NS-12 and Virgin Galactic VP-03 suborbital flights
OSD-41	Microgravity effect on C. elegans N2/VC (CERISE 8days)
OSD-410	Dataset for dose and time-dependent transcriptional response to ionizing radiation exposure.
OSD-411	Plant Gravity Perception: Pilot (PGP Pilot)
OSD-412	Spatial characterization of microbial communities on multi-species leafy greens grown simultaneously in the Veggie vegetable production systems on the International Space Station VEG-03D
OSD-413	Spatial characterization of microbial communities on multi-species leafy greens grown simultaneously in the Veggie vegetable production systems on the International Space Station VEG-03E
OSD-414	Spatial characterization of microbial communities on multi-species leafy greens grown simultaneously in the Veggie vegetable production systems on the International Space Station VEG-03F
OSD-415	Serum metabolomics associating with circulating microRNA profiles reveal the role of miR-383-5p in rat hippocampus under simulated microgravity
OSD-416	Characterizing Epigenetic Changes in Methylation Mutants (elp2-5 and met1-7) in Response to Spaceflight. [Bisulfite-Seq]
OSD-418	Transcriptional profiling of gastrocnemius from rats exposed to partial weight bearing treatment to mimic Martian gravity
OSD-419	Transcriptional profiling of the right gastrocnemius muscle from mice flown on the RR-1 mission
OSD-42	Expression data from C. elegans
OSD-420	Transcriptional profiling of spleens from mice flown on the RR-9 mission
OSD-421	Transcriptional profiling of thymus from mice flown on the RR-9 mission
OSD-422	Transcriptional profiling of gastrocnemius muscle from rats flown on the SLS-1 mission
OSD-423	Transcriptional profiling of thymus tissue from rats flown on the SLS-2 mission
OSD-425	The effect of microgravity on the epigenetic modification in C. elegans - JAXA EPIGENETICS spaceflight experiment
OSD-426	Cerium oxide nanoparticle administration to skeletal muscle cells under different gravity and radiation conditions
OSD-427	Characterizing Epigenetic Changes in Methylation Mutants (elp2-5 and met1-7) in Response to Spaceflight. [RNA-Seq]
OSD-428	Profiling the response of Arabidopsis thaliana to altered gravity environments: Exposure of the 14-3-3k:GFP overexpression line on the F-104 Starfighter, second flight
OSD-43	Effect of simulated microgravity on E. coli K12 MG1655 growth and gene expression
OSD-430	Modulation of gene expression in rat muscle cells following treatment with nanoceria in different gravity regimes
OSD-431	Microgravity and space radiation exert either opposite or synergic effects on single molecular pathways
OSD-432	Expression profiling reveals transcriptional regulation by Fbxw7/mTOR pathway in radiation-induced mouse thymic lymphomas
OSD-434	Arabidopsis thaliana in altered gravity: the 14-3-3k:GFP overexpression line on the F-104 Starfighter, first flight
OSD-435	Effects of low-dose oxygen ions and protons on cardiac function and structure in male C57BL/6J mice (echocardiogram/ultrasonography)
OSD-436	Arabidopsis thaliana in altered gravity: WS in C-9 parabolic flight, 2015
OSD-437	Transcriptional and Post transcriptional Regulation of Seedling Development in Microgravity
OSD-44	Transcriptomics analysis of etiolated Arabidopsis thaliana seedlings in response to microgravity
OSD-45	Action of microgravity on root development
OSD-450	Arabidopsis thaliana in altered gravity: the 14-3-3κ:GFP overexpression line in C-9 parabolic flight, 2013
OSD-452	Accelerated knowledge discovery from omics data by optimal experimental design
OSD-455	Transcriptomic responses in mouse blood during the first week after in vivo gamma irradiation.
OSD-457	Expression profiles in multiple tissues of WT and Nrf2-knockout mouse under space flight
OSD-46	Gamma radiation and HZE treatment of seedlings in Arabidopsis
OSD-462	Transcriptional profiling, protein expression profiling, and phosphoprotein profiling of kidneys from mice flown on the RR-10 mission
OSD-463	Transcriptional profiling of livers from mice flown on the RR-23 mission
OSD-464	Transcriptional profiling of lungs from mice flown on the RR-23 mission
OSD-465	Metagenome profiling of feces from mice flown on the RR-23 mission
OSD-466	Microbiome profiling of feces from mice flown on the RR-10 mission
OSD-467	Transcriptomic profiling of cortical bone from hindlimb unloaded mice
OSD-469	Transcriptomic analysis of the interaction between FLOWERING LOCUS T induction and photoperiodic signaling in response to spaceflight
OSD-47	Rodent Research-1 (RR1) National Lab Validation Flight: Mouse liver transcriptomic, proteomic, epigenomic and histology data
OSD-470	Draft genome sequence of Klebsiella quasipneumoniae subsp. similipneumoniae strain IF3SW-P1 isolated from the International Space Station
OSD-471	Spaceflight-Induced Bone Loss Alters Failure Mode and Reduces Bending Strength in Murine Spinal Segments from Bion-M1
OSD-476	Plants grown in Apollo lunar regolith present stress-associated transcriptomes that inform prospects for lunar exploration
OSD-477	Dose-dependent skeletal deficits due to varied reductions in mechanical loading in rats (Femur - microCT, three-point bending, histomorphometry)
OSD-478	Altered rodent gait characteristics after ~35 days in orbit aboard the International Space Station
OSD-479	The impact of deep space radiation on cognitive performance: From biological sex to biomarkers to countermeasures (Elevated Plus Maze, Novel Object Recognition, Open Field, Radial Arm Water Maze, and Three Chamber Social Isolation/Interaction)
OSD-48	Rodent Research-1 (RR1) NASA Validation Flight: Mouse liver transcriptomic, proteomic, epigenomic and histology data
OSD-480	Plant Gravity Perception (PGP) Flight Study
OSD-481	New insights into the role of lncRNA after spaceflight
OSD-483	small-RNA sequencing of sEV isolated from plasma of astronauts
OSD-484	Astronauts plasma-derived exosomes induced gene expression in AC16 cells
OSD-485	Changes of Gene Expression in Euglena gracilis Obtained During the 29th DLR Parabolic Flight Campaign
OSD-486	Fifteen days of microgravity causes growth in calvaria of mice (STS-131)
OSD-487	The Maleth Program: Malta’s first space mission discoveries on the microbiome of diabetic foot ulcers
OSD-488	Characterizing SERCA Function in Murine Skeletal Muscles after 35-37 Days of Spaceflight from RR-1 and RR-9 (calcium uptake and Western blot in soleus and tibialis anterior)
OSD-489	Quantifying Cancellous Bone Structural Changes in Microgravity: Axial Skeleton Results from the RR-1 Mission
OSD-49	Multi-omic investigations of mouse liver subjected to simulated spaceflight freezing and storage protocols
OSD-490	Elevated plus-maze performance of Fischer-344 rats as a function of age and of exposure to 56Fe particles
OSD-492	Effects of heavy particle irradiation and diet on object recognition memory in rats
OSD-496	The SOG1 transcriptional activator and the MyB3R family of repressors control a complex gene network in response to DNA damage in Arabidopsis [SOG1 ChIP-seq]
OSD-497	Fungal Diversity associated with space-craft assembly facility (SAF)
OSD-498	The SOG1 transcriptional activator and the MYB3R family of repressors control a complex gene network in response to DNA damage in Arabidopsis [RNA-seq gIR vs mock wt]
OSD-5	Transcription profiling of activated human T cells induced by microgravity to identify apoptotic genes and other immune response genes
OSD-50	Evaluation of in vitro macrophage differentiation during space flight
OSD-500	Altered Quorum Sensing and Physiology of Staphylococcus aureus During Spaceflight Detected by Multi-omics Data Analysis (BRIC-23: Secretomics)
OSD-502	The SOG1 transcriptional activator and the MYB3R family of repressors control a complex gene network in response to DNA damage in Arabidopsis [RNA-seq myb3r135 vs wt]
OSD-505	Quantitative proteomic analytic approaches to identify metabolic changes in the medial prefrontal cortex of rats exposed to space radiation
OSD-506	Transcriptional profiling of spleens from mice flown on the RR-23 mission
OSD-508	The SOG1 transcriptional activator and the MYB3R family of repressors control a complex gene network in response to DNA damage in Arabidopsis [RNA-seq t vs t0]
OSD-509	A CRISPR-based assay for the study of eukaryotic DNA repair onboard the International Space Station.
OSD-51	Woman skeletal muscle transcriptome with bed rest and countermeasures.
OSD-510	The SOG1 transcriptional activator and the MYB3R family of repressors control a complex gene network in response to DNA damage in Arabidopsis [RNA-seq DREMmodel]
OSD-511	Transcriptional profiling of mammary glands from mice flown on the RRRM-1 mission
OSD-512	Transcriptional profiling of adrenal glands from mice flown on the RR-23 mission
OSD-513	Transcriptional profiling of kidneys from mice flown on the RR-23 mission
OSD-514	Artificial gravity partially protects space-induced neurological deficits in Drosophila melanogaster
OSD-515	Transcriptional profiling of thymus from mice flown on the RR-23 mission
OSD-516	Modeling cellular responses to serum and vitamin D in microgravity using a human kidney microphysiological system
OSD-518	Opposing influences of TAC1 and LAZY1 on Lateral Shoot Orientation in Arabidopsis
OSD-519	PUCHI represses early meristem formation in developing lateral roots of Arabidopsis thaliana
OSD-52	Expression data from SPHINX (SPaceflight of Huvec: an INtegrated eXperiment)
OSD-520	Changes in DNA Methylation in Arabidopsis thaliana Plants Exposed Over Multiple Generations to Gamma Radiation
OSD-522	Integrative Transcriptomics and Proteomics Profiling of Arabidopsis thaliana Elucidates Novel Mechanisms Underlying Spaceflight Adaptation
OSD-524	Ionizing radiation induces transgenerational effects of DNA methylation in zebrafish
OSD-525	Transcriptional profiling of cerebellums from mice flown on the RR-23 mission
OSD-528	Development of an Inexpensive 3D Clinostat and Comparison with Other Microgravity Simulators using Mycobacterium marinum
OSD-53	Spaceflight Modulates Gene Expression in Astronauts
OSD-530	Cell-free RNA analysis of plasma samples collected from six astronauts in JAXA Cell-Free Epigenome (CFE) Study
OSD-531	Identification of gravitropic response indicator genes in Arabidopsis inflorescence stems
OSD-532	Space flight mouse plasma cell-free RNA sequencing in Mouse Habitat Unit-1 (MHU-1)
OSD-536	Gene expression profiling for spaceflight induced-neuroinflammation in the mouse brain
OSD-539	Transcriptomic response of bioengineered human cartilage to parabolic flight microgravity is sex-dependent
OSD-54	Immune responses to the in vitro LPS assault engineered in the spaceflight multi-omics study
OSD-540	Ten-day human unilateral lower limb suspension and active recovery in young healthy men
OSD-542	Effects of 14 days of confinement on blood gene expression profiles in men
OSD-545	Expression of miRNA, lncRNA and mRNA in human lymphoblastoid TK6 cells under simulated microgravity after ionizing radiation
OSD-546	SCD – Stem Cell Differentiation Toward Osteoblast Onboard the International Space Station
OSD-547	Whole gene expression data from osteocyte-like cell line MLO-Y4 under large gradient high magnetic field (LG-HMF)
OSD-548	Balancing apelin and angiotensin-II signaling to reduce heart injury during weightlessness
OSD-55	microRNA expression profiles in human peripheral blood lymphocytes cultured in modeled microgravity
OSD-554	Characterization of Biofilm Formation, Growth, and Gene Expression on Different Materials and Environmental Conditions in Microgravity (Gene expression of Pseudomonas aeruginosa biofilms)
OSD-557	Spaceflight influences gene expression, photoreceptor integrity, and oxidative stress related damage in the murine retina (RR-9)
OSD-56	Gene expression profiling of human peripheral blood lymphocytes cultured in modeled microgravity
OSD-561	Bulk RNA sequencing and spatially resolved transcriptional profiling of cerebellums from mice flown on the RRRM-2 mission
OSD-562	Bulk RNA sequencing and spatially resolved transcriptional profiling of hippocampi from mice flown on the RRRM-2 mission
OSD-563	Bulk RNA sequencing and spatially resolved transcriptional profiling of cerebellums from mice flown on the RR-10 mission
OSD-564	Bulk RNA sequencing and spatially resolved transcriptional profiling of hippocampi from mice flown on the RR-10 mission
OSD-565	Utilizing the KSC Fixation Tube to Conduct Human-Tended Plant Biology Experiments on a Suborbital Spaceflight
OSD-566	Sexual Dimorphism during Integrative Endocrine and Immune Responses to Ionizing Radiation in Mice -- Adrenal data
OSD-568	Characterization of mouse ocular responses (Microscopy) to a 35-day (RR-9) spaceflight mission: Evidence of blood-retinal barrier disruption and ocular adaptations
OSD-569	Whole Blood Measurements from the SpaceX Inspiration4 Mission (RNA-seq, epitranscriptome, WGS, clonal hematopoiesis, CBC)
OSD-57	RNA-Seq analysis identifies potential modulators of gravity response in Ceratopteris spores: Evidence for modulation by calcium pumps and apyrase activity
OSD-570	SpaceX Inspiration4 PBMC Profiling: snRNA-seq, snATAC-seq, and T-cell and B-cell repertoire profiling
OSD-571	SpaceX Inspiration4 Plasma Profiling: Proteomics, EVPs, Metabolomics, cfDNA Sequencing and cfRNA Sequencing
OSD-572	SpaceX Inspiration4 Oral, Nasal, and Skin Metagenomic and Metatranscriptomic Microbial Swabs
OSD-573	SpaceX Inspiration4 Dragon Capsule Metagenomic and Metatranscriptomic Microbial Swabs
OSD-574	SpaceX Inspiration4 Deltoid Skin and Microbiome Data: Spatial Transcriptomics (NanoString GeoMx), Metageomics, and Metatranscriptomics
OSD-575	SpaceX Inspiration4 Blood Serum Metabolic Panel and Immune/Cardiac Cytokine Arrays (Comprehensive Metabolic Panel and Multiplex)
OSD-576	Transcriptional profiling of tibialis anterior muscle from mice flown on the RR-23 mission
OSD-58	Genes Required for Survival in Microgravity Revealed by Genome-Wide Yeast Deletion Collections Cultured during Spaceflight
OSD-580	Transcriptional profiling of heart tissue from mice flown on the RRRM-2 mission
OSD-581	A molecular study of Italian ryegrass grown on Martian regolith simulant
OSD-582	Resequencing of select microbial isolates from the International Space Station with the Nanopore MinION
OSD-583	Characterization of mouse ocular responses (intraocular pressure) to a 35-day (RR-9) spaceflight mission: Evidence of blood-retinal barrier disruption and ocular adaptations
OSD-59	RNA-Seq transcriptome analysis of reactive oxygen species gene network in Mizuna plants grown in long-term space flight
OSD-590	First transcriptome profiling of D. melanogaster after development in a deep underground low radiation background laboratory
OSD-591	Effects of low-dose oxygen ions and protons on cardiac function and structure in male C57BL/6J mice (western blot, histology, and immunohistochemistry)
OSD-592	Artificial gravity partially protects space-induced neurological deficits in Drosophila melanogaster (Immunohistochemistry)
OSD-594	Advancing the automation of plant nucleic acid extraction for rapid diagnosis of plant diseases in space
OSD-595	Artificial gravity partially protects space-induced neurological deficits in Drosophila melanogaster
OSD-596	Artificial gravity partially protects space-induced neurological deficits in Drosophila melanogaster (Behavior, Climbing)
OSD-599	Transcriptomic Effects on the Mouse Heart Following 30 Days on the International Space Station.
OSD-6	Transcription profiling of rat keratinocytes exposed to a 56Fe ion beam
OSD-60	Exposure of zebrafish larvae to relative microgravity between 5-6 days post-fertilization
OSD-608	Dose-dependent skeletal deficits due to varied reductions in mechanical loading in rats (Tibia - pQCT)
OSD-609	Drosophila parasitoids go to space: Unexpected and differential effects of spaceflight on hosts and their parasitoids - Wasp Leptopilina heterotoma 14 data
OSD-61	Effect of a 91 day long stay in weightlessness on the International Space Station on mouse skin physiology
OSD-610	Drosophila parasitoids go to space: Unexpected and differential effects of spaceflight on hosts and their parasitoids - Wasp Leptopilina boulardi 17 data
OSD-611	Postsynaptic density radiation signature following space irradiation
OSD-612	Bulk RNA sequencing and single nuclei transcriptomics and epigenomics of brain tissue from mice flown on the RR-10 mission
OSD-613	Bulk RNA sequencing and single nuclei transcriptomics and epigenomics of brain tissue from mice flown on the RRRM-2 mission
OSD-615	Glycome profiling and immunohistochemistry uncover changes in cell walls of Arabidopsis thaliana roots during spaceflight: Advanced Plant EXperiment (APEX) 03-1 Raw Dataset
OSD-616	Influence of Sex Hormones on Nervous System and Musculoskeletal Health in Micro and Martian Fractional Gravity in Rat Analogues (Force Plate; Soleus)
OSD-617	Influence of gonadectomy on muscle health in micro- and partial-gravity environments in rats (Estrous Cycle Monitoring)
OSD-618	Combined space stressors induce independent behavioral deficits predicted by early peripheral blood monocytes (Behavioral Assays)
OSD-62	Molecular mechanism of flocculation self-recognition in yeast and its role in mating and survival
OSD-622	Microgravity effects on leaf morphology, cell structure, carbon metabolism and mRNA expression of dwarf wheat
OSD-625	Single-molecule long-read methylation profiling reveals regional DNA methylation regulated by Elongator Complex Subunit 2 in Arabidopsis roots experiencing spaceflight
OSD-627	Characterization of Biofilm Formation, Growth, and Gene Expression on Different Materials and Environmental Conditions in Microgravity (Morphology of Pseudomonas aeruginosa biofilms)
OSD-628	Characterization of Biofilm Formation, Growth, and Gene Expression on Different Materials and Environmental Conditions in Microgravity (Morphology of Penicillium rubens biofilms)
OSD-63	Transcription profiling of rat response to changes in developmental stage - 3 types of tissue, 3 gravity conditions, 2 developmental conditions
OSD-630	SpaceX Inspiration4 Stool Metagenome Profiling
OSD-635	Spaceflight effects on human vascular smooth muscle cell phenotype and function
OSD-64	Microbial Observatory (ISS-MO): Molecular characterization of Bacillus issensis sp. nov. isolated from various quarters of the International Space Station
OSD-640	Combined space stressors induce independent behavioral deficits predicted by early peripheral blood monocytes (flow cytometry)
OSD-65	Microbial Observatory (ISS-MO): Microbial diversity
OSD-652	Influence of gonadectomy on muscle health in micro- and partial-gravity environments in rats (Grip; force transducer)
OSD-653	Influence of gonadectomy on muscle health in micro- and partial-gravity environments in rats (Tibia; pQCT)
OSD-654	Toward countering muscle and bone loss with spaceflight: GSK3 as a potential target (Tibia, RR9 and HLU, MicroCT and DXA Scanning)
OSD-656	SpaceX Inspiration4 Urine Inflammation Panel (Multiplex, NULISAseq)
OSD-658	Simulated Galactic Cosmic Ray Exposure Activates Dose-Dependent DNA Repair Response and Downregulates Glucosinolate Pathway in Arabidopsis Seedlings
OSD-660	Toward countering muscle and bone loss with spaceflight: GSK3 as a potential target (Tibialis Anterior, RR9, Western Blot)
OSD-661	Toward countering muscle and bone loss with spaceflight: GSK3 as a potential target (Lumbar Spine, HLS, DXA Scanning)
OSD-662	Toward countering muscle and bone loss with spaceflight: GSK3 as a potential target (Soleus, RR1, RR9, RR18, Bion-M1, HLU/HLS, Western Blot, Histology, and Muscle Contractility)
OSD-663	Toward countering muscle and bone loss with spaceflight: GSK3 as a potential target (Femur, RR9 and HLS, DXA Scanning and Western Blot)
OSD-664	Toward countering muscle and bone loss with spaceflight: GSK3 as a potential target (Extensor Digitorum Longus, BION-M1, Western blot)
OSD-665	Transcriptional profiling of right extensor digitorum longus muscle from mice flown on the RR-23 mission
OSD-666	Transcriptional profiling of right quadriceps femoris muscle from mice flown on the RR-23 mission
OSD-667	Transcriptional profiling of colon from mice flown on the RR-10 mission
OSD-67	Microbial Observatory (ISS-MO): Study of BSL-2 bacterial isolates from the International Space Station
OSD-670	CI Asteroid Regolith as an In Situ Plant Growth Medium for Space Crop Production
OSD-678	Light has a principal role in the Arabidopsis transcriptomic response to the spaceflight environment
OSD-679	Head-Down Tilt As a Model for Intracranial and Intraocular Pressures, and Retinal Changes during Spaceflight (Eye, MRI, Optical Coherence Tomography, Tonometry, A-scan)
OSD-68	Microbial Observatory (ISS-MO): Draft Genome Sequence of two Aspergillus fumigatus Strains Isolated from the International Space Station
OSD-680	Head-Down Tilt As a Model for Intracranial and Intraocular Pressures, and Retinal Changes during Spaceflight (Optic Nerve, MRI)
OSD-681	Head-Down Tilt As a Model for Intracranial and Intraocular Pressures, and Retinal Changes during Spaceflight (Subcutaneous Tissue and Subdural Space, Body Temperature and Intracranial Pressure Biotelemetry)
OSD-682	Spaceflight-Induced Gene Expression Profiles in the Mouse Brain Are Attenuated by Treatment with the Antioxidant BuOE - Cornu Ammonis 1
OSD-683	Response of Staphylococcus aureus physiology and Agr quorum sensing to low shear modelled microgravity
OSD-684	Human skeletal muscle tissue chip autonomous payload reveals changes in fiber type and metabolic gene expression due to spaceflight.
OSD-685	Spaceflight-Induced Gene Expression Profiles in the Mouse Brain Are Attenuated by Treatment with the Antioxidant BuOE - Dentate Gyrus
OSD-686	Impact of spaceflight and artificial gravity on sulfur metabolism in mouse liver: sulfur metabolomic and transcriptomic analysis
OSD-687	SpaceX Inspiration4 T-Cell Histone Modification Profiling (H3K4me1, H3K4me3, H3K27ac)
OSD-689	Single-cell analysis identifies conserved features of immune dysfunction in simulated microgravity and spaceflight
OSD-69	Microbial Observatory (ISS-MO): Indoor microbiome study of the International Space Station surfaces
OSD-690	Nrf2 alleviates spaceflight-induced immunosuppression and thrombotic microangiopathy in mice
OSD-691	Spaceflight increases sarcoplasmic reticulum Ca2+ leak and this cannot be counteracted with BuOE treatment (Soleus muscle from RR-18, Western Blot and ATPase Assays)
