id	title
OSD-694	Predicting how varying moisture conditions impact the microbiome of dust collected from the International Space Station (ISS)
OSD-698	Spaceflight-Induced Gene Expression Profiles in the Mouse Brain Are Attenuated by Treatment with the Antioxidant BuOE - Frontal Cortex
OSD-699	Spaceflight-Induced Gene Expression Profiles in the Mouse Brain Are Attenuated by Treatment with the Antioxidant BuOE - Cerebral Cortex
OSD-7	The Arabidopsis spaceflight transcriptome: a comparison of whole plants to discrete root, hypocotyl and shoot responses to the orbital environment
OSD-70	Environmental and facility conditions promote singular gravity responses of transcriptome during Drosophila metamorphosis
OSD-701	Exposure to elevated relative humidity in laboratory chambers alters fungal gene expression in dust from the International Space Station (ISS)
OSD-702	Effects of 32 Days Aboard the ISS on Quadricep Tendon Nanomechanics (Quadricep femoris tendon, RR-1 and Atomic Force Microscopy)
OSD-71	Immediate Transcriptional Changes in Response to High Dose Radiation Exposure
OSD-714	Lunar gravity prevents skeletal muscle atrophy but not myofiber type shift in mice
OSD-715	Characterization of mouse ocular response to a 35-day spaceflight mission: Evidence of blood-retinal barrier disruption and ocular adaptations - Proteomics data
OSD-718	Effects of 32 Days Aboard the ISS on Gastrocnemius Tendon Nanomechanics (Gastrocnemius tendon, RR-1 and Atomic Force Microscopy)
OSD-719	Sexual Dimorphism during Integrative Endocrine and Immune Responses to Ionizing Radiation in Mice -- Blood data
OSD-72	Space environmental factor impacts upon murine colon microbiota and mucosal homeostasis
OSD-720	Long-lasting sex-specific alteration in left ventricular cardiac transcriptome following gamma and simGCRsim radiation
OSD-722	Impact of modeled microgravity stress on innate immunity in a beneficial animal-microbe symbiosis
OSD-723	Substrate Matters: Ionic Silver Alters Lettuce Growth, Nutrient Uptake, and Root Microbiome in a Hydroponics System
OSD-728	Simulated microgravity triggers a membrane adaptation to stress in E. coli REL606
OSD-73	Transcriptome Profiles in Normal Human Bronchial Epithelial Cells after Exposure to gamma-rays and different HZE particles
OSD-734	The International Space Station Has a Unique and Extreme Microbial and Chemical Environment Driven by Use Patterns
OSD-738	Effects of Space Flight on Inflammasome Activation in the Brain of Mice (Brain, Western Blot and ECLIA)
OSD-74	Densely Ionizing Radiation Effects on the Microenvironment Promote Aggressive Trp53 Null Mammary Carcinomas
OSD-742	Metagenome profiling of feces from mice flown on the RRRM-1 mission
OSD-75	MicroRNA expression of C. elegans in space environment
OSD-751	Effects of Space Flight on Inflammasome Activation in the Brain of Mice (Cortex; ECLIA)
OSD-752	Effects of Space Flight on Inflammasome Activation in the Brain of Mice (Hippocampus; ECLIA)
OSD-76	Zebrafish larvae submitted to simulated microgravity on a clinostat (CLINO) at 5dpf for one day
OSD-770	Transcriptional profiling of soleus muscle from mice flown on the RR-23 mission
OSD-771	Transcriptional profiling of kidney tissue from mice flown on the Rodent Research Reference Mission-2 (RRRM-2)
OSD-772	PH-04 Chile Peppers in Space
OSD-776	The impact of deep space radiation on cognitive performance: From biological sex to biomarkers to countermeasures (Flow Cytometry, Blood)
OSD-777	The impact of deep space radiation on cognitive performance: From biological sex to biomarkers to countermeasures; (Flow Cytometry, Microglia)
OSD-778	The impact of deep space radiation on cognitive performance: From biological sex to biomarkers to countermeasures (Flow Cytometry, Synapse from Hippocampus)
OSD-78	Transcription profiling of human MCF10A cells subjected to ionizing radiation and treatment with transforming growth factor beta-1
OSD-781	Skeletal muscle-on-a-chip in microgravity as a platform for regeneration modeling and drug screening - myoblast data
OSD-782	Multi-omics profiling reveals ethylene signalling as a key pathway underlying both genetic and epigenetic responses to low-dose ionizing radiation in Arabidopsis
OSD-783	Multidirectional effect of low-intensity electrical myostimulation on gene expression and phenotype in thigh and calf muscles after one week of disuse - soleus data
OSD-784	Multidirectional effect of low-intensity electrical myostimulation on gene expression and phenotype in thigh and calf muscles after one week of disuse - vastus lateralis data
OSD-787	Skeletal muscle-on-a-chip in microgravity as a platform for regeneration modeling and drug screening - vastus lateralis data
OSD-788	Impact of simulated microgravity on the growth and proteomic profile of Enterobacter cloacae
OSD-79	Murine microenvironment metaprofiles associate with human cancer etiology and intrinsic subtypes
OSD-792	Transcriptomic analysis of embryonic mouse hypothalamic N38 cells exposed to high-energy protons and/or simulated microgravity.
OSD-793	Mission SpaceX CRS-16 RRRM-1 space flight induced skin genomic plasticity via an epigenetic trigger
OSD-794	Characterization of Spacesuit Associated Microbial Communities and Their Implications for NASA Missions.
OSD-8	Gravitational and magnetic field variations synergize to cause subtle variations in the global transcriptional state of Arabidopsis in vitro callus cultures
OSD-80	Response of mammary tissue to high-LET HZE particle (Silicon ions) radiation or low-LET gamma-rays
OSD-804	37-Day microgravity exposure in 16-Week female C57BL/6J mice during the NASA Rodent Research 1 mission is associated with bone loss specific to weight-bearing skeletal sites (femur and vertebrae, micro computed tomography)
OSD-809	Effects of an anaerobic membrane bioreactor upset event on nitrogen speciation and microbial community in a downstream phototrophic membrane bioreactor
OSD-81	Bacillus subtilis strains at low-pressure: 5 kPa versus 101 kPa growth
OSD-810	RNA-seq analysis in simulated microgravity unveils down-regulation of the beta-rhizobial siderophore phymabactin.
OSD-811	Space microgravity increases expression of genes associated with proliferation and differentiation in human cardiac spheres
OSD-812	Simulated microgravity impairs human NK cell cytotoxic activity against space radiation-relevant leukemic cells.
OSD-813	Impact of near continuous low dose rate neutron irradiation on pregnancy outcomes in mice.
OSD-82	Microbial monitoring in the ISS-Kibo
OSD-825	Evaluating sex-specific responses to western diet across the lifespan: impact on cardiac function and transcriptomic signatures in C57BL/6J mice at 530 and 640/750 days of age
OSD-83	Comparative Transcriptomic Analysis of Adult Medaka Tissues Sampled after Adaptation to a Space Environment
OSD-832	Effects of 5-Ion Beam Irradiation and Hindlimb Unloading on Metabolic Pathways in Plasma and Brain of Behaviorally Tested WAG/Rij Rats - Plasma data
OSD-833	Effects of 5-Ion Beam Irradiation and Hindlimb Unloading on Metabolic Pathways in Plasma and Brain of Behaviorally Tested WAG/Rij Rats - Hippocampus data
OSD-834	Effects of 5-Ion Beam Irradiation and Hindlimb Unloading on Metabolic Pathways in Plasma and Brain of Behaviorally Tested WAG/Rij Rats - Cortex data
OSD-835	Effects of 5-Ion Beam Irradiation and Hindlimb Unloading on Metabolic Pathways in Plasma and Brain of Behaviorally Tested WAG/Rij Rats
OSD-836	Effects of photon irradiation in the presence and absence of hindlimb unloading on the behavioral performance and metabolic pathways in the plasma of Fischer rats
OSD-837	Effects of 5-ion 6-beam sequential irradiation in the presence and absence of hindlimb or control hindlimb unloading on behavioral performances and plasma metabolic pathways of Fischer 344 rats
OSD-84	Biomolecule Sequencer
OSD-840	Unraveling the ceRNA Network: Insights into PI3K-AKT Pathway in Irradiated Mouse Thymus [miRNA]
OSD-85	Transcriptomic response of Drosophila melanogaster pupae developed in hypergravity
OSD-855	Apollo 17 Challenge System - Seed Germination (Cabbage, Brussel Sprouts, Radish and Lettuce)
OSD-856	Effect of varying amounts of simulated lunar soil batch #005 upon growth of lettuce explants
OSD-86	A study of alterations DNA epigenetic modifiincations (5mC and 5hmC) influenced by simulated microgravity in human lymphoblastoid cells
OSD-863	Effects of microgravity on human iPSC-derived neural organoids on the International Space Station - cortical organoids
OSD-867	Impact of spaceflight on gene expression in cultured human mesenchymal stem/stromal cell
OSD-87	Spaceflight effects on the mouse retina: Histological, gene expression and epigenetic changes after flight on STS-135
OSD-871	Effects of microgravity on human iPSC-derived neural organoids on the International Space Station - dopaminergic organoids
OSD-876	Zfp697 is an RNA-binding protein that regulates skeletal muscle inflammation and remodeling
OSD-877	Element content of seedlings from seed and liverwort plant tissue in Apollo 15 and Apollo 16 post-flight biomedical evaluations (MMP 21243, MMP 21242)
OSD-88	Age and Space Irradiation Modulate Tumor Progression: Implications for Carcinogenesis Risk
OSD-880	Zfp697 is an RNA-binding protein that regulates skeletal muscle inflammation and remodeling - Zfp697 skeletal muscle knockout RNA-Seq of unloading-reloading protocol
OSD-881	Life long effects of radiation and high fat diet on the mouse right ventricular tissue
OSD-883	Analysis of Vegetable Seedlings Grown in Contact with Apollo 14 Lunar Surface Fines
OSD-89	Proton Irradiation Impacts Age Driven Modulations of Cancer Progression Influenced by Immune System Transcriptome Modifications from Splenic Tissue
OSD-9	Response of human lymphoblastoid cells to activated medium
OSD-90	RNA-seq analysis of mycobacteria stress response to microgravity
OSD-91	A study of gene expression influenced by simulated microgravity in human lymphoblastoid cells
OSD-92	Response of the EPI-200 human 3-D skin model to high and low doses of protons
OSD-93	Gene expression profiles of irradiated lung tissue in three mouse strains
OSD-94	DNA copy number analysis from mice with radiation-induced acute myeloid leukemia
OSD-95	A Molecular Genetic Basis Explaining Altered Bacterial Behavior in Space
OSD-96	The development of Drosophila melanogaster during space flight
OSD-97	Gene-expression profiling of Saccharomyces cerevisiae irradiated by high-LET radiations
OSD-98	Rodent Research-1 (RR1) NASA Validation Flight: Mouse adrenal gland transcriptomic, proteomic, and epigenomic data
OSD-99	Rodent Research-1 (RR1) NASA Validation Flight: Mouse extensor digitorum longus muscle transcriptomic and epigenomic data
